{
  "meta": {
    "version": "1.0.0",
    "gameVersion": "未知（待录入）",
    "updatedAt": "2026-08-18",
    "count": 125,
    "builtAt": "2026-08-18T09:42:15.552Z",
    "generatedBy": "cotw-helper/build.mjs"
  },
  "maps": [
    {
      "id": "乌尔霍加热带稀树草原",
      "name": "乌尔霍加热带稀树草原"
    },
    {
      "id": "桑达帕坦狩猎保护区",
      "name": "桑达帕坦狩猎保护区"
    },
    {
      "id": "阿斯基岭狩猎保护区",
      "name": "阿斯基岭狩猎保护区"
    },
    {
      "id": "赫希费尔登狩猎保护区",
      "name": "赫希费尔登狩猎保护区"
    },
    {
      "id": "费南多自然公园",
      "name": "费南多自然公园"
    },
    {
      "id": "澳大利亚翡翠海岸",
      "name": "澳大利亚翡翠海岸"
    },
    {
      "id": "育空河谷自然保护区",
      "name": "育空河谷自然保护区"
    },
    {
      "id": "银岭峰",
      "name": "银岭峰"
    },
    {
      "id": "莱顿湖区",
      "name": "莱顿湖区"
    },
    {
      "id": "梅德韦泰嘉国家公园",
      "name": "梅德韦泰嘉国家公园"
    },
    {
      "id": "雷文图里海岸",
      "name": "雷文图里海岸"
    },
    {
      "id": "新英格兰山脉",
      "name": "新英格兰山脉"
    },
    {
      "id": "秘鲁狩猎保护区",
      "name": "秘鲁狩猎保护区"
    },
    {
      "id": "密西西比阿克里斯保护区",
      "name": "密西西比阿克里斯保护区"
    },
    {
      "id": "夸特罗科利纳斯野生动物保护区",
      "name": "夸特罗科利纳斯野生动物保护区"
    },
    {
      "id": "蒂阿拉罗瓦国家公园",
      "name": "蒂阿拉罗瓦国家公园"
    },
    {
      "id": "精灵之丘狩猎庄园",
      "name": "精灵之丘狩猎庄园"
    },
    {
      "id": "阿罗约牧场",
      "name": "阿罗约牧场"
    },
    {
      "id": "萨尔茨维森公园",
      "name": "萨尔茨维森公园"
    }
  ],
  "furTypes": [
    {
      "id": "褐色",
      "name": "褐色"
    },
    {
      "id": "灰色",
      "name": "灰色"
    },
    {
      "id": "黑色",
      "name": "黑色"
    },
    {
      "id": "白色亚种",
      "name": "白色亚种"
    },
    {
      "id": "白化",
      "name": "白化"
    },
    {
      "id": "橙色",
      "name": "橙色"
    },
    {
      "id": "黑化",
      "name": "黑化"
    },
    {
      "id": "白色无条纹",
      "name": "白色无条纹"
    },
    {
      "id": "白色",
      "name": "白色"
    },
    {
      "id": "金色",
      "name": "金色"
    },
    {
      "id": "浅褐色",
      "name": "浅褐色"
    },
    {
      "id": "姜黄",
      "name": "姜黄"
    },
    {
      "id": "姜黄条纹",
      "name": "姜黄条纹"
    },
    {
      "id": "花斑",
      "name": "花斑"
    },
    {
      "id": "深棕色",
      "name": "深棕色"
    },
    {
      "id": "深褐色",
      "name": "深褐色"
    },
    {
      "id": "咖啡色",
      "name": "咖啡色"
    },
    {
      "id": "棕褐色",
      "name": "棕褐色"
    },
    {
      "id": "亚麻色",
      "name": "亚麻色"
    },
    {
      "id": "浅灰色",
      "name": "浅灰色"
    },
    {
      "id": "深色",
      "name": "深色"
    },
    {
      "id": "深红色",
      "name": "深红色"
    },
    {
      "id": "棕红色",
      "name": "棕红色"
    },
    {
      "id": "棕色",
      "name": "棕色"
    },
    {
      "id": "墨黑",
      "name": "墨黑"
    },
    {
      "id": "马赛克",
      "name": "马赛克"
    },
    {
      "id": "黑足狼",
      "name": "黑足狼"
    },
    {
      "id": "珍稀云杉纹",
      "name": "珍稀云杉纹"
    },
    {
      "id": "珍稀桦木纹",
      "name": "珍稀桦木纹"
    },
    {
      "id": "珍稀栎树纹",
      "name": "珍稀栎树纹"
    },
    {
      "id": "珍稀斑纹",
      "name": "珍稀斑纹"
    },
    {
      "id": "珍稀灰白斑",
      "name": "珍稀灰白斑"
    },
    {
      "id": "珍稀两色斑",
      "name": "珍稀两色斑"
    },
    {
      "id": "灰褐色",
      "name": "灰褐色"
    },
    {
      "id": "橄榄色",
      "name": "橄榄色"
    },
    {
      "id": "深绿色",
      "name": "深绿色"
    },
    {
      "id": "带花斑",
      "name": "带花斑"
    },
    {
      "id": "肉桂色",
      "name": "肉桂色"
    },
    {
      "id": "红棕色",
      "name": "红棕色"
    },
    {
      "id": "灵性",
      "name": "灵性"
    },
    {
      "id": "暗黑色",
      "name": "暗黑色"
    },
    {
      "id": "珍稀栗色斑",
      "name": "珍稀栗色斑"
    },
    {
      "id": "珍稀米黄斑",
      "name": "珍稀米黄斑"
    },
    {
      "id": "珍稀冰川纹",
      "name": "珍稀冰川纹"
    },
    {
      "id": "珍稀灵性斑",
      "name": "珍稀灵性斑"
    },
    {
      "id": "珍稀斑点",
      "name": "珍稀斑点"
    },
    {
      "id": "棕色鬃毛",
      "name": "棕色鬃毛"
    },
    {
      "id": "黝黑渐层",
      "name": "黝黑渐层"
    },
    {
      "id": "眼镜型斑纹",
      "name": "眼镜型斑纹"
    },
    {
      "id": "极简的斑纹",
      "name": "极简的斑纹"
    },
    {
      "id": "X型斑纹",
      "name": "X型斑纹"
    },
    {
      "id": "杂乱的斑纹",
      "name": "杂乱的斑纹"
    },
    {
      "id": "繁复的斑纹",
      "name": "繁复的斑纹"
    },
    {
      "id": "红化赤色",
      "name": "红化赤色"
    },
    {
      "id": "无斑纹",
      "name": "无斑纹"
    },
    {
      "id": "浅色面部",
      "name": "浅色面部"
    },
    {
      "id": "红化灰黄色",
      "name": "红化灰黄色"
    },
    {
      "id": "红化",
      "name": "红化"
    },
    {
      "id": "玫瑰斑纹",
      "name": "玫瑰斑纹"
    },
    {
      "id": "斑点",
      "name": "斑点"
    },
    {
      "id": "黑化（无纹路）",
      "name": "黑化（无纹路）"
    },
    {
      "id": "炭色黑狼",
      "name": "炭色黑狼"
    },
    {
      "id": "黑化（带纹路）",
      "name": "黑化（带纹路）"
    },
    {
      "id": "珍稀瓷釉色",
      "name": "珍稀瓷釉色"
    },
    {
      "id": "珍稀绯霞色",
      "name": "珍稀绯霞色"
    },
    {
      "id": "珍稀织锦色",
      "name": "珍稀织锦色"
    },
    {
      "id": "珍稀暗影色",
      "name": "珍稀暗影色"
    },
    {
      "id": "珍稀羊皮色",
      "name": "珍稀羊皮色"
    },
    {
      "id": "珍稀鎏金暮色",
      "name": "珍稀鎏金暮色"
    },
    {
      "id": "珍稀象牙树皮色",
      "name": "珍稀象牙树皮色"
    },
    {
      "id": "原始",
      "name": "原始"
    },
    {
      "id": "冬季",
      "name": "冬季"
    },
    {
      "id": "米色",
      "name": "米色"
    },
    {
      "id": "红色",
      "name": "红色"
    },
    {
      "id": "蛋白",
      "name": "蛋白"
    },
    {
      "id": "深灰色",
      "name": "深灰色"
    },
    {
      "id": "珍稀双魂",
      "name": "珍稀双魂"
    },
    {
      "id": "珍稀疤纹",
      "name": "珍稀疤纹"
    },
    {
      "id": "珍稀刃风",
      "name": "珍稀刃风"
    },
    {
      "id": "珍稀破晓",
      "name": "珍稀破晓"
    },
    {
      "id": "珍稀空谷",
      "name": "珍稀空谷"
    },
    {
      "id": "珍稀墓隐",
      "name": "珍稀墓隐"
    },
    {
      "id": "珍稀先锋",
      "name": "珍稀先锋"
    },
    {
      "id": "珍稀霜痕",
      "name": "珍稀霜痕"
    },
    {
      "id": "珍稀战棘",
      "name": "珍稀战棘"
    },
    {
      "id": "蓝色",
      "name": "蓝色"
    },
    {
      "id": "白顶",
      "name": "白顶"
    },
    {
      "id": "白棕色",
      "name": "白棕色"
    },
    {
      "id": "两色",
      "name": "两色"
    },
    {
      "id": "稀释",
      "name": "稀释"
    },
    {
      "id": "珍稀银河纹",
      "name": "珍稀银河纹"
    },
    {
      "id": "珍稀花瓣泡芙纹",
      "name": "珍稀花瓣泡芙纹"
    },
    {
      "id": "珍稀肉桂条纹",
      "name": "珍稀肉桂条纹"
    },
    {
      "id": "珍稀蛛丝之谜纹",
      "name": "珍稀蛛丝之谜纹"
    },
    {
      "id": "珍稀细雨纹",
      "name": "珍稀细雨纹"
    },
    {
      "id": "珍稀暗黑漂流纹",
      "name": "珍稀暗黑漂流纹"
    },
    {
      "id": "青铜色",
      "name": "青铜色"
    },
    {
      "id": "黑金",
      "name": "黑金"
    },
    {
      "id": "紫灰",
      "name": "紫灰"
    },
    {
      "id": "珍稀焦糖色",
      "name": "珍稀焦糖色"
    },
    {
      "id": "珍稀烟灰色",
      "name": "珍稀烟灰色"
    },
    {
      "id": "珍稀黑棕色",
      "name": "珍稀黑棕色"
    },
    {
      "id": "珍稀红褐色",
      "name": "珍稀红褐色"
    },
    {
      "id": "珍稀黑白色",
      "name": "珍稀黑白色"
    },
    {
      "id": "珍稀三花",
      "name": "珍稀三花"
    },
    {
      "id": "珍稀条纹",
      "name": "珍稀条纹"
    },
    {
      "id": "珍稀暗红色",
      "name": "珍稀暗红色"
    },
    {
      "id": "黑色斑点",
      "name": "黑色斑点"
    },
    {
      "id": "棕色混种",
      "name": "棕色混种"
    },
    {
      "id": "黑金色",
      "name": "黑金色"
    },
    {
      "id": "粉色",
      "name": "粉色"
    },
    {
      "id": "赤色斑点",
      "name": "赤色斑点"
    },
    {
      "id": "深色斑点",
      "name": "深色斑点"
    },
    {
      "id": "巧克力色",
      "name": "巧克力色"
    },
    {
      "id": "珍稀金斑",
      "name": "珍稀金斑"
    },
    {
      "id": "珍稀棕斑",
      "name": "珍稀棕斑"
    },
    {
      "id": "珍稀摩卡",
      "name": "珍稀摩卡"
    },
    {
      "id": "珍稀银斑",
      "name": "珍稀银斑"
    },
    {
      "id": "雪纹",
      "name": "雪纹"
    },
    {
      "id": "焦糖色",
      "name": "焦糖色"
    },
    {
      "id": "秸秆",
      "name": "秸秆"
    },
    {
      "id": "珍稀灰斑",
      "name": "珍稀灰斑"
    },
    {
      "id": "珍稀对半纹",
      "name": "珍稀对半纹"
    },
    {
      "id": "珍稀拿铁斑",
      "name": "珍稀拿铁斑"
    },
    {
      "id": "珍稀头骨纹",
      "name": "珍稀头骨纹"
    },
    {
      "id": "珍稀雪纹",
      "name": "珍稀雪纹"
    },
    {
      "id": "灰白色",
      "name": "灰白色"
    },
    {
      "id": "蓝灰色",
      "name": "蓝灰色"
    },
    {
      "id": "黄色",
      "name": "黄色"
    },
    {
      "id": "黄褐色",
      "name": "黄褐色"
    },
    {
      "id": "浅银色",
      "name": "浅银色"
    },
    {
      "id": "珍稀迷踪雾色",
      "name": "珍稀迷踪雾色"
    },
    {
      "id": "珍稀朝霞斑纹",
      "name": "珍稀朝霞斑纹"
    },
    {
      "id": "珍稀古钢雾色",
      "name": "珍稀古钢雾色"
    },
    {
      "id": "珍稀烈焰斑纹",
      "name": "珍稀烈焰斑纹"
    },
    {
      "id": "珍稀迷雾斑纹",
      "name": "珍稀迷雾斑纹"
    },
    {
      "id": "珍稀月影斑纹",
      "name": "珍稀月影斑纹"
    },
    {
      "id": "黑棕色",
      "name": "黑棕色"
    },
    {
      "id": "黑白色",
      "name": "黑白色"
    },
    {
      "id": "混合色",
      "name": "混合色"
    },
    {
      "id": "蜂蜜色",
      "name": "蜂蜜色"
    },
    {
      "id": "光滑",
      "name": "光滑"
    },
    {
      "id": "大胆",
      "name": "大胆"
    },
    {
      "id": "珍稀血月纹",
      "name": "珍稀血月纹"
    },
    {
      "id": "珍稀糖杖纹",
      "name": "珍稀糖杖纹"
    },
    {
      "id": "珍稀樱花纹",
      "name": "珍稀樱花纹"
    },
    {
      "id": "珍稀甘草纹",
      "name": "珍稀甘草纹"
    },
    {
      "id": "珍稀夜罂粟纹",
      "name": "珍稀夜罂粟纹"
    },
    {
      "id": "珍稀神秘雪花纹",
      "name": "珍稀神秘雪花纹"
    },
    {
      "id": "珍稀薄荷纹",
      "name": "珍稀薄荷纹"
    },
    {
      "id": "珍稀玫瑰花蕾霜样纹",
      "name": "珍稀玫瑰花蕾霜样纹"
    },
    {
      "id": "珍稀猩红茄属纹",
      "name": "珍稀猩红茄属纹"
    },
    {
      "id": "茶色",
      "name": "茶色"
    },
    {
      "id": "沙色",
      "name": "沙色"
    },
    {
      "id": "烟灰色",
      "name": "烟灰色"
    },
    {
      "id": "灰色带花斑",
      "name": "灰色带花斑"
    },
    {
      "id": "亚麻色带花斑",
      "name": "亚麻色带花斑"
    },
    {
      "id": "红化巧克力色",
      "name": "红化巧克力色"
    },
    {
      "id": "杂色",
      "name": "杂色"
    },
    {
      "id": "杂色中",